line,id,speaker,text,ami_label,link,relationship,api_labels,topic,entities
1,0,Programmer,Hello Apiza,BE-POSITIVE,,,,,
2,1,Apiza,Hi!,BE-POSITIVE,1,POS,,,
2,2,Apiza," I'm Apiza, a virtual assistant designed to help you use a new API. ",INFORM,,,,,
2,3,Apiza,How can I help you?,ELICIT-OFFER-OR-SUGGESTION,,,,,
3,4,Programmer,How do I get keyboard events,ELICIT-OFFER-OR-SUGGESTION,,,patterns,,
4,5,Programmer,How do I register keyboard events?,ELICIT-OFFER-OR-SUGGESTION,,,patterns,,
5,6,Programmer,Apiza are you there,ELICIT-COMMENT-ABOUT-UNDERSTANDING,,,,,
6,7,Programmer,<@UB659D0FM> do you hear me,ELICIT-COMMENT-ABOUT-UNDERSTANDING,,,,,
7,8,Programmer,How do I register keyboard events with allegro?,ELICIT-OFFER-OR-SUGGESTION,5,REP,patterns,,
8,9,Apiza,Something like ALLEGRO_EVENT_KEY_DOWN? ,SUGGEST,8,POS,basic,ALLEGRO_EVENT_KEY_DOWN,
8,10,Apiza,"If you have an event ```ev```, you can check the value of ```ev.keyboard.keycode```.",INFORM,9,CONT,structure patterns,ALLEGRO_EVENT_KEY_DOWN,
9,11,Apiza,"You do not need to specifically register the keyboard, though it should be installed with\n```bool al_install_keyboard(void)```",SUGGEST,10,CONT,directives patterns,al_install_keyboard,
10,12,Programmer,What header do i need to include for the allegro key events,ELICIT-INFORM,,,structure,ALLEGRO_EVENT_KEY_*,
11,13,Programmer,?,OTHER,12,CONT,,,
12,14,Apiza,Events and keyboard input are included in the allegro.h header.,INFORM,13,POS,structure,ALLEGRO_EVENT_* ALLEGRO_EVENT_KEY_*,
13,15,Programmer,What are the allegro event key right and allegro event key left variables called,ELICIT-INFORM,,,basic,ALLEGRO_EVENT_KEY_*,
14,16,Apiza,"ALLEGRO_KEY_LEFT and ALLEGRO_KEY_RIGHT are key codes, which are returned in the event.keyboard.keycode field of the ALLEGRO_KEY_DOWN and ALLEGRO_KEY_UP events.",INFORM,15,POS,structure patterns basic,ALLEGRO_KEY_*,
15,17,Programmer,how to pop elements off the allegro event queue,ELICIT-OFFER-OR-SUGGESTION,,,patterns,ALLEGRO_EVENT_QUEUE,
16,18,Apiza,"The function\n\n```void al_wait_for_event(ALLEGRO_EVENT_QUEUE *queue, ALLEGRO_EVENT *ret_event)\t```\n\n",INFORM,17,POS,basic,ALLEGRO_EVENT_QUEUE al_wait_for_event,
16,19,Apiza,"Description: Wait until the event queue specified is non-empty. If ret_event is not NULL, the first event in the queue will be copied into ret_event and removed from the queue. If ret_event is NULL the first event is left at the head of the queue.",INFORM,18,CONT,functionality,al_wait_for_event,
17,20,Programmer,Is there a timeout to wait for an event?,ELICIT-INFORM,,,functionality,ALLEGRO_EVENT_*,
18,21,Apiza,Do either of these functions look useful?\n\n,SUGGEST,20,PART,,al_wait_for_event al_wait_for_event_until,
18,22,Apiza,"```bool al_wait_for_event_timed(ALLEGRO_EVENT_QUEUE *queue,\n ALLEGRO_EVENT *ret_event, float secs)```\n\n```bool al_wait_for_event_until(ALLEGRO_EVENT_QUEUE *queue,\n ALLEGRO_EVENT *ret_event, ALLEGRO_TIMEOUT *timeout)```",INFORM,21,CONT,basic,al_wait_for_event al_wait_for_event_until,
19,23,Programmer,What is ALLEGRO_TIMEOUT,ELICIT-INFORM,22,FOL,basic,al_wait_for_event_until ALLEGRO_TIMEOUT,
20,24,Apiza,ALLEGRO_TIMEOUT\n\n```typedef struct ALLEGRO_TIMEOUT ALLEGRO_TIMEOUT;```\n\n,INFORM,23,POS,basic,ALLEGRO_TIMEOUT,
20,25,Apiza,Represent a timeout value. The size of the structure is known so it can be statically allocated. The contents are private.\n\n,INFORM,24,CONT,quality structure basic,ALLEGRO_TIMEOUT,
20,26,Apiza,"Initialized with\n\n```void al_init_timeout(ALLEGRO_TIMEOUT *timeout, double seconds)```",INFORM,25,CONT,patterns basic,ALLEGRO_TIMEOUT al_init_timeout,
21,27,Programmer,what is the function signature of al_get_timer_event_source,ELICIT-INFORM,,,basic,al_get_timer_event_source,
22,28,Apiza,"```void al_set_timer_speed(ALLEGRO_TIMER *timer, double new_speed_secs)```",INFORM,27,POS,basic,al_set_timer_event_source,
23,29,Apiza,Correction:\n,OTHER,28,FIX,,,
23,30,Apiza,```ALLEGRO_EVENT_SOURCE *al_get_timer_event_source(ALLEGRO_TIMER *timer)```,INFORM,29,CONT,basic,al_get_timer_event_source,
24,31,Programmer,please provide more information about al_wait_for_event_timed,ELICIT-INFORM,22,FOL,basic,al_wait_for_event_timed,
25,32,Apiza,al_wait_for_event_timed:\n\n,INFORM,31,POS,,al_wait_for_event_timed,
25,33,Apiza,"Wait until the event queue specified is non-empty. If ret_event is not NULL, the first event in the queue will be copied into ret_event and removed from the queue. If ret_event is NULL the first event is left at the head of the queue.\n\n",INFORM,32,CONT,functionality,al_wait_for_event_timed,
25,34,Apiza,"secs determines approximately how many seconds to wait. If the call times out, false is returned. Otherwise, if an event ocurred, true is returned.\n\nFor compatibility with all platforms, secs must be 2,147,483.647 seconds or less.",INFORM,33,CONT,functionality directives environment,al_wait_for_event_timed,
26,35,Programmer,what are all the possible allegro event types?,ELICIT-INFORM,,,structure,ALLEGRO_EVENT_*,
27,36,Programmer,What are the allegro keyboard input event types,ELICIT-INFORM,,,structure,ALLEGRO_EVENT_KEY_*,
28,37,Apiza,"There are about 27 event types, related to KEY, MOUSE, JOYSTICK, TIME, DISPLAY, and TOUCH. ",INFORM,35,POS,structure,ALLEGRO_EVENT_*,
28,38,Apiza,The event types related to Key Events are ALLEGRO_EVENT_KEY_DOWN and ALLEGRO_EVENT_KEY_UP.,INFORM,36,POS,structure,ALLEGRO_EVENT_KEY_*,
29,39,Apiza,The event types related to Key Events are ALLEGRO_EVENT_KEY_DOWN and ALLEGRO_EVENT_KEY_UP.,OTHER,38,REP,structure,ALLEGRO_EVENT_KEY_*,
30,40,Programmer,how to play a sound with allegro',ELICIT-OFFER-OR-SUGGESTION,,,patterns,,
31,41,Programmer,How to play a sound with Allegro?,OTHER,40,FIX,patterns,,
32,42,Apiza,The simplest method is al_play_sample\n\n,SUGGEST,41,POS,patterns,al_play_sample,
32,43,Apiza,"```bool al_play_sample(ALLEGRO_SAMPLE *spl, float gain, float pan, float speed,\n ALLEGRO_PLAYMODE loop, ALLEGRO_SAMPLE_ID *ret_id)```\n\n",INFORM,42,CONT,basic,al_play_sample,
32,44,Apiza,Plays a sample on one of the sample instances created by al_reserve_samples. ,INFORM,43,CONT,functionality patterns,al_play_sample,
32,45,Apiza,"Returns true on success, false on failure. ",INFORM,44,CONT,functionality,al_play_sample,
32,46,Apiza,Playback may fail because all the reserved sample instances are currently used.,INFORM,45,CONT,functionality,al_play_sample,
33,47,Programmer,What is ALLEGRO_PLAYMODE,ELICIT-INFORM,43,FOL,basic,al_play_sample ALLEGRO_PLAYMODE,
34,48,Programmer,What is ALLEGRO_SAMPLE_ID,ELICIT-INFORM,43,FOL,basic,al_play_sample ALLEGRO_SAMPLE_ID,
35,49,Apiza,That refers to an enum. ,INFORM,47,POS,basic,al_play_sample ALLEGRO_PLAYMODE,
35,50,Apiza,"Options are ALLEGRO_PLAYMODE_ONCE, ALLEGRO_PLAYMODE_LOOP, or ALLEGRO_PLAYMODE_BIDIR",INFORM,49,CONT,structure,ALLEGRO_PLAYMODE,
36,51,Apiza,Regarding ALLEGRO_SAMPLE_ID variable ret_id - if non-NULL the variable which this points to will be assigned an id representing the sample being played. ,INFORM,48,POS,functionality patterns,al_play_sample ALLEGRO_SAMPLE_ID,
36,52,Apiza,"If al_play_sample returns false, then the contents of ret_id are invalid and must not be used as argument to other functions.",INFORM,51,CONT,functionality directives,al_play_sample,
37,53,Apiza,I was able to find an example function call:\n\n,INFORM,46,FOL,examples,al_play_sample,
37,54,Apiza,"```al_play_sample(sample, 1.0, 0.0,1.0,ALLEGRO_PLAYMODE_LOOP,NULL);```",INFORM,53,CONT,examples,al_play_sample,
38,55,Programmer,What is an ALLEGRO_SAMPLE,ELICIT-INFORM,43,FOL,basic,al_play_sample ALLEGRO_SAMPLE,
39,56,Apiza,"An ALLEGRO_SAMPLE object stores the data necessary for playing pre-defined digital audio. It holds a user-specified PCM data buffer and information about its format (data length, depth, frequency, channel configuration). You can have the same ALLEGRO_SAMPLE playing multiple times simultaneously.\n\n",INFORM,55,POS,functionality purpose patterns,ALLEGRO_SAMPLE,
39,57,Apiza,Samples are often initialized with the function al_load_sample:\n\n,INFORM,56,CONT,patterns,ALLEGRO_SAMPLE al_load_sample,
39,58,Apiza,```ALLEGRO_SAMPLE *al_load_sample(const char *filename)```,INFORM,57,CONT,basic,al_load_sample,
40,59,Programmer,how to free pointers allegro,ELICIT-OFFER-OR-SUGGESTION,,,patterns,,
41,60,Programmer,how to free ALLEGRO_SAMPLE,ELICIT-OFFER-OR-SUGGESTION,59,FIX,patterns,ALLEGRO_SAMPLE,
42,61,Apiza,The function al_destroy_sample should work:\n\n,SUGGEST,60,POS,patterns,al_destroy_sample ALLEGRO_SAMPLE,
42,62,Apiza,```void al_destroy_sample(ALLEGRO_SAMPLE *spl)```,INFORM,21,CONT,basic,al_destroy_sample,
43,63,Programmer,al_load_sample is returning NULL,INFORM,58,FOL,functionality,al_load_sample,
44,64,Apiza,It looks like al_load_sample only returns NULL on failure. ,INFORM,63,PART,functionality,al_load_sample,
44,65,Apiza,Could I see how you are calling the function?,ELICIT-INFORM,63,FOL,examples,al_load_sample,
45,66,Programmer,spl = al_load_sample( AUDIO_SAMPLE_PATH );,INFORM,65,POS,examples,al_load_sample,
46,67,Apiza,"If AUDIO_SAMPLE_PATH is a valid path, this call should return a sample.",INFORM,66,PART,functionality patterns,al_load_sample,
47,68,Apiza,There a couple of other reasons this function might not work. ,INFORM,67,CONT,,al_load_sample,
47,69,Apiza,Have you called al_install_audio() and al_init_acodec_addon()?,ELICIT-INFORM,66,FOL,patterns,al_load_sample al_install_audio al_init_acodec_addon,
48,70,Programmer,finction signature for al_install_audio(),ELICIT-INFORM,69,FOL,basic,al_install_audio,
49,71,Programmer,function signature for al_init_acodec_addon(),ELICIT-INFORM,69,FOL,basic,al_init_acodec_addon,
50,72,Apiza,```bool al_install_audio(void)```,INFORM,70,POS,basic,,
51,73,Apiza,```bool al_init_acodec_addon(void)```,INFORM,71,POS,basic,,
52,74,Apiza,"If it helps,",BE-POSITIVE,41,POS,,,
52,75,Apiza, I was able to extract the following example that should Play an audio file.\n\n,INFORM,74,CONT,patterns,,
52,76,Apiza,"```ALLEGRO_SAMPLE *sample=NULL;\n\n...\n\nif(!al_install_audio()){\n fprintf(stderr, ""failed to initialize audio!\\n"");\n return -1;\n}\n\nif(!al_init_acodec_addon()){\n fprintf(stderr, ""failed to initialize audio codecs!\\n"");\n return -1;\n}\n\t\nif (!al_reserve_samples(1)){\n fprintf(stderr, ""failed to reserve samples!\\n"");\n return -1;\n}\n\n...\n\t\nsample = al_load_sample( ""footstep.wav"" );\n\n...\n\nal_play_sample(sample, 1.0, 0.0,1.0,ALLEGRO_PLAYMODE_LOOP,NULL);```",INFORM,75,CONT,examples,,
53,77,Programmer,how to display text with allegro,ELICIT-OFFER-OR-SUGGESTION,,,patterns,,
54,78,Apiza,"There are several functions to display text, ",INFORM,77,PART,patterns,,
54,79,Apiza,the simplest is al_draw_text\n\n,SUGGEST,77,POS,patterns,al_draw_text,
54,80,Apiza,"```void al_draw_text(const ALLEGRO_FONT *font,\n ALLEGRO_COLOR color, float x, float y, int flags,\n char const *text) ```\n\n",INFORM,80,CONT,basic,al_draw_text,
54,81,Apiza,"Writes the NUL-terminated string text onto the target bitmap at position x, y, using the specified font.\n\n",INFORM,81,CONT,functionality,al_draw_text,
54,82,Apiza,The flags parameter can be 0 or one of the following flags:\n\nALLEGRO_ALIGN_LEFT - Draw the text left-aligned (same as 0).\nALLEGRO_ALIGN_CENTRE - Draw the text centered around the given position.\nALLEGRO_ALIGN_RIGHT - Draw the text right-aligned to the given position.\nIt can also be combined with this flag:\n\nALLEGRO_ALIGN_INTEGER - Always draw text aligned to an integer pixel position. This was formerly the default behaviour. ,INFORM,82,CONT,directives patterns,al_draw_text,
54,83,Apiza,"Since: 5.0.8, 5.1.4\nThis function does not support newline characters (\\n), but you can use al_draw_multiline_text for multi line text output.",INFORM,83,CONT,environment directives patterns,al_draw_text,
55,84,Programmer,load ALLEGRO_FONT,ELICIT-OFFER-OR-SUGGESTION,80,FOL,patterns,ALLEGRO_FONT,
56,85,Programmer,load ALLEGRO_COLOR,ELICIT-OFFER-OR-SUGGESTION,80,FOL,patterns,ALLEGRO_COLOR,
57,86,Apiza,This function should work:\n\n,SUGGEST,84,POS,patterns,ALLEGRO_FONT al_load_font,
57,87,Apiza,"```ALLEGRO_FONT *al_load_font(char const *filename, int size, int flags)```",INFORM,86,CONT,basic,al_load_font,
58,88,Apiza,"I could not find a function to load ALLEGRO_COLOR, ",INFORM,85,NEG,functionality,ALLEGRO_COLOR,
58,89,Apiza,"but there are several functions that take primitive parameters and return ALLEGRO_COLOR, ",INFORM,86,FOL,patterns,ALLEGRO_COLOR,
58,90,Apiza,"such as\n\n```ALLEGRO_COLOR al_color_cmyk(float c, float m, float y, float k)```",INFORM,89,CONT,basic,ALLEGRO_COLOR al_color_cmyk,
59,91,Programmer,al_load_font flags,ELICIT-INFORM,87,FOL,basic ,al_load_font,
60,92,Programmer,more information about al_load_font ,ELICIT-INFORM,87,FOL,basic,al_load_font,
60,93,Programmer,please,BE-POSITIVE,92,CONT,,,
61,94,Programmer,more information about al_color_cmyk ,ELICIT-INFORM,90,FOL,basic,al_color_cmyk,
61,95,Programmer,please,BE-POSITIVE,94,CONT,,,
62,96,Apiza,Sure thing!\n\n,BE-POSITIVE,92,POS,,,
62,97,Apiza,"```ALLEGRO_FONT *al_load_font(char const *filename, int size, int flags)```\n\n",INFORM,96,CONT,basic,al_load_font,
62,98,Apiza,"Loads a font from disk. This will use al_load_bitmap_font_flags if you pass the name of a known bitmap format, or else al_load_ttf_font.\n\n",INFORM,97,CONT,functionality control,al_load_font,
62,99,Apiza,The flags parameter is passed through to either of those functions. Bitmap and TTF fonts are also affected by the current bitmap flags at the time the font is loaded.,INFORM,98,CONT,functionality control,al_load_font,
63,100,Apiza,"```ALLEGRO_COLOR al_color_cmyk(float c, float m, float y, float k)```\n\n",INFORM,94,POS,basic,al_color_cmyk,
63,101,Apiza,"Return an ALLEGRO_COLOR structure from CMYK values (cyan, magenta, yellow, black).",INFORM,100,CONT,functionality,al_color_cmyk,
64,102,Apiza,Would you like me to list all of the functions related to ALLEGRO_COLOR?,OFFER,100,FOL,structure,ALLEGRO_COLOR,
65,103,Programmer,YES ,ASSESS,102,POS,,ALLEGRO_COLOR,
65,104,Programmer,please,BE-POSITIVE,103,CONT,,,
66,105,Apiza,```\nal_color_cmyk\nal_color_cmyk_to_rgb\nal_color_hsl\nal_color_hsl_to_rgb\nal_color_hsv\nal_color_hsv_to_rgb\nal_color_html\nal_color_html_to_rgb\nal_color_rgb_to_html\nal_color_name\nal_color_name_to_rgb\nal_color_rgb_to_cmyk\nal_color_rgb_to_hsl\nal_color_rgb_to_hsv\nal_color_rgb_to_name\nal_color_rgb_to_xyz\nal_color_xyz\nal_color_xyz_to_rgb\nal_color_rgb_to_xyy\nal_color_xyy\nal_color_xyy_to_rgb\nal_color_rgb_to_lab\nal_color_lab\nal_color_lab_to_rgb\nal_color_rgb_to_lch\nal_color_lch\nal_color_lch_to_rgb\nal_color_distance_ciede2000_lab\nal_color_rgb_to_yuv\nal_color_yuv\nal_color_yuv_to_rgb\nal_get_allegro_color_version\nal_is_color_valid\n```,INFORM,103,POS,structure,ALLEGRO_COLOR,
67,106,Programmer,al_load_font example ,ELICIT-INFORM,97,FOL,examples,al_load_font,
67,107,Programmer,please,BE-POSITIVE,106,CONT,,,